im_version,im_rating,id,title,content,im_votesum,im_votecount,date,author_uri,author_name,link_attributes_related,link_attributes_href,content_attributes_term,content_attributes_label
1.2024.177,1,11439177993,Upload Limits,"They limited the features that used to be free, so now they’re conning you for your data and your training of their AI, asking for $20 a month for premium, which they don’t specify the limits of, and the AI will still be coached for corporate, manufactured answers from Wikipedia and other Official Sources. Also, your messages can violate their terms of service and be removed from your chat now! We have blatantly lost to big tech; a previous NSA director joined OpenAI’s safety and security committee this month—interpret that however you may.
Good luck to everyone out there! 
I’d personally remove this app from your phone, but spending half your life on screens can be fun too! To each other their own.
Cheers.",0,0,2024-06-29T21:43:39-07:00,https://itunes.apple.com/us/reviews/id1556201370,Ethan Hack,related,https://itunes.apple.com/us/review?id=6448311069&type=Purple%20Software,Application,Application
1.2024.177,4,11439102490,Great ai,Great ai but could be improved It’s very stupid sometimes.,0,0,2024-06-29T21:10:31-07:00,https://itunes.apple.com/us/reviews/id1637902739,Well it’s a review,related,https://itunes.apple.com/us/review?id=6448311069&type=Purple%20Software,Application,Application
1.2024.177,5,11438955758,I call it Smart rock,I love ChatGPT and it’s predecessor components dolly I use it every day. It’s a companion to learn the code of product that I care about. It is a creative assistant that gets me through rough iterations of ideas stories essays startups go to market plans everything and anything it is in leverage for my meme Ling. It makes me a better meme Lord and I think that we’re coming to an age when returning I should say meme Lord and social structure of useful memes that can be spread in adopted and therefore everybody comes wealthy. Everybody has abundance and get away from this post agricultural I control the water source kind of warlord that we’ve been living in with not enough innovation too much centralization not enough localism too much regulation and I’m just grateful that Sammon his team created such a useful tool.,0,0,2024-06-29T20:08:45-07:00,https://itunes.apple.com/us/reviews/id961815740,airparsa,related,https://itunes.apple.com/us/review?id=6448311069&type=Purple%20Software,Application,Application
1.2024.177,5,11438741551,So awesome!,The best!,0,0,2024-06-29T18:42:39-07:00,https://itunes.apple.com/us/reviews/id363588473,Grant Lincoln,related,https://itunes.apple.com/us/review?id=6448311069&type=Purple%20Software,Application,Application
1.2024.177,5,11438653518,GPT CHAT AI,It is amazing to be able to get the proper assistance from this app and with technology evolving the capabilities it can provide for you.,0,0,2024-06-29T18:06:49-07:00,https://itunes.apple.com/us/reviews/id1576382205,MrWClll,related,https://itunes.apple.com/us/review?id=6448311069&type=Purple%20Software,Application,Application
1.2024.177,5,11438568760,Ratings of ChatGpt 3.5,Fantastic,0,0,2024-06-29T17:31:53-07:00,https://itunes.apple.com/us/reviews/id117331300,Future of AI,related,https://itunes.apple.com/us/review?id=6448311069&type=Purple%20Software,Application,Application
1.2024.177,5,11438470237,Chat GBT continues to blow my mind:),Never stops amazing me how spot on and incisive (his/her) answers are. It saves me hours of time researching what! I can now get via chat gbt in seconds. Forgive the aforementioned gender reference but it seems to have become personalized almost as my first ai friend:),0,0,2024-06-29T16:49:49-07:00,https://itunes.apple.com/us/reviews/id178430511,annieandalexander,related,https://itunes.apple.com/us/review?id=6448311069&type=Purple%20Software,Application,Application
1.2024.177,5,11438185676,❤️,I love this app the most. Please give the premium version free,0,0,2024-06-29T14:46:04-07:00,https://itunes.apple.com/us/reviews/id1672721830,Mahiraaaaa,related,https://itunes.apple.com/us/review?id=6448311069&type=Purple%20Software,Application,Application
1.2024.177,5,11438144161,Love it,I love it!! It has been really helpful.,0,0,2024-06-29T14:28:48-07:00,https://itunes.apple.com/us/reviews/id640254944,ajsjei3jjsjsjehshb,related,https://itunes.apple.com/us/review?id=6448311069&type=Purple%20Software,Application,Application
1.2024.177,5,11438100096,"Wonderful, amazing app overall","Overall, this is an amazing app! I think it is just wonderful. I would love to make this app my primary go to for searches and information. The things that are disappointing, although they do not impact my overall rating, are the following:
I do not like any of the voices available in voice mode. They really need to add some more. I understand why they took away the sky voice, but they can easily find others just as amiable.
I would be willing to pay for the plus version, but from what I can tell, it does not take away message caps. and uses up my message caps even to pursue a single line of query.
I wish they had a plan without message caps and more voices",0,0,2024-06-29T14:10:58-07:00,https://itunes.apple.com/us/reviews/id33282906,Happiness69,related,https://itunes.apple.com/us/review?id=6448311069&type=Purple%20Software,Application,Application
1.2024.177,1,11437801905,deception,"Вот ваш отзыв:

""ChatGPT's paid version is deceptive and fraudulent. They claim you'll have access, but your session can be abruptly cut off at any time, limiting interaction to roughly 30 minutes. I strongly advise against using the paid version as it operates on a dishonest money-grabbing scheme.""",0,0,2024-06-29T12:15:00-07:00,https://itunes.apple.com/us/reviews/id1373251114,Dancerking,related,https://itunes.apple.com/us/review?id=6448311069&type=Purple%20Software,Application,Application
1.2024.177,5,11437537104,This technology could be compared to the Invention & greatness of the Internet itself,"I’ve been exploring and using this app since it first came to the App Store, and was reading about it prior to its arrival. I am somewhat tech savvy, and I am always looking for the next great piece of tech. I’m sure this has been said a million times but Google needs to watch its back. I know Bard / Genesis is out there though it’s availability is in question. I have and explored it and I can’t say with any certainty that it’s not comparable to ChatGPT, but ChatGPT came out of the box ready to go… ready to use and with every update it seems to get better and better. I use the free version. I wish I could afford to pay $20 a month for an app, but I cannot.

I can only imagine how good it is if I could afford it, though if I was unaware of a paid version, I wouldn’t feel cheated because the free version is more than I could dream of. This company and its creators and all of the personnel that works for on it should be extremely proud of themselves for what they’ve created. As with many, I am fearful of some of AI ‘s future but for now this is a tool that has helped me in my life on many instances and occasions. I’m so happy that I live in a time where we have this kind of tool available to the masses. Thank you, AI and ChatGPT and my appreciation goes to everyone involved in the creation of this phenomenal piece of technology… Thx Very Much.. Steve (and it is probably plain to see but I did not use any assistance with AI to create this review. This is a human only created comment).. and I make this comment humorously 😁",0,0,2024-06-29T10:41:08-07:00,https://itunes.apple.com/us/reviews/id41145588,Schteven,related,https://itunes.apple.com/us/review?id=6448311069&type=Purple%20Software,Application,Application
1.2024.177,5,11437468890,ChatGPT,"I like ChatGPT, but it’s not really showing me any pictures when I ask them",0,0,2024-06-29T10:18:08-07:00,https://itunes.apple.com/us/reviews/id1672659986,Jklvho;ijvcfhgiu,related,https://itunes.apple.com/us/review?id=6448311069&type=Purple%20Software,Application,Application
1.2024.177,5,11437197929,Chat GPT 2024,This is so purposeful to my business and my mindset! It helps program my algorithm to keep me in alignment with my purpose/highest good! 🎆🤍 it’s amazinggggg to be 18 at a time such as this! 🧘🏾‍♀️🌴 10/10 highly recommended! It just makes you a better thinker overall!,0,0,2024-06-29T08:52:32-07:00,https://itunes.apple.com/us/reviews/id848954780,joshlyn a,related,https://itunes.apple.com/us/review?id=6448311069&type=Purple%20Software,Application,Application
1.2024.177,5,11437072865,I love chat gpt.,"When I can’t explain how I feel chat gpt always got me . Helped me with resumes , ideas , talking with customers. I cannot wait for the voice feature as it will feel like I have my own assistant. I would love it if I could simply tell juniper to remind me to do something at this time or date since I am so busy for example “hey juniper could you remind me to call Anthony Ramos at 3:30 pm” would be cool to receive a call from juniper. “Hey don’t forget to call Anthony soon”",0,0,2024-06-29T08:14:54-07:00,https://itunes.apple.com/us/reviews/id1081459452,Beasty_Chino,related,https://itunes.apple.com/us/review?id=6448311069&type=Purple%20Software,Application,Application
1.2024.177,3,11436909456,Stopped working,"For some unknown reason the app stopped replying. I get a message about my VPN, but I have always had that and it worked before.",0,0,2024-06-29T07:26:36-07:00,https://itunes.apple.com/us/reviews/id120341202,Shellyb1221,related,https://itunes.apple.com/us/review?id=6448311069&type=Purple%20Software,Application,Application
1.2024.177,5,11436656193,The friend I always wanted,"Now I can bother “Coach” instead of my loved ones.  Ah, you saved my relationship by allowing me to vomit all my loosely held ideas and thoughts here!  I am at work on a novel and the ability to dive into nomenclature and jargon of area I have no entry point to is amazing.  I can ask, “Hey Coach, what do you call that metal ring around the end of a hose that holds the metal part to the rubber part so that water doesn’t go spraying everywhere. What is that called?” Then Coach will tell me.  You can improv with Coach.  You can come incorrect with Coach and he(for me he’s a he), will correct you.  Thanks Coach!",0,0,2024-06-29T06:10:12-07:00,https://itunes.apple.com/us/reviews/id41024697,Itheriot,related,https://itunes.apple.com/us/review?id=6448311069&type=Purple%20Software,Application,Application
1.2024.177,5,11436356669,❤️,The best so far❤️,0,0,2024-06-29T04:29:17-07:00,https://itunes.apple.com/us/reviews/id1647244651,Lil Brown 100,related,https://itunes.apple.com/us/review?id=6448311069&type=Purple%20Software,Application,Application
1.2024.177,5,11435859493,Йй,Мне очень нравиться но. Называет контент «неуместным»и удаляет хотя там ничего запрещенного не было. Я запарилась уже,0,0,2024-06-29T01:09:56-07:00,https://itunes.apple.com/us/reviews/id1299667866,пирожок с вареньем,related,https://itunes.apple.com/us/review?id=6448311069&type=Purple%20Software,Application,Application
1.2024.177,2,11435815784,“Im sorry but i cant assist with that.” error,"Whenever i used up my 4.0 cap and it sends me to 3.5,its as if the AI just doesnt want to resoond aith anything but “Im sorry,but i cant assist with that.” Someone needs to fix this asap. Im getting sick and tired of it.",0,0,2024-06-29T00:51:30-07:00,https://itunes.apple.com/us/reviews/id1022943334,DawsonTheMighty,related,https://itunes.apple.com/us/review?id=6448311069&type=Purple%20Software,Application,Application
1.2024.177,3,11434870404,+18 NSFW,"Dude add a 18+ for the premium please. I’m not gonna pay 20$ a month for a chatbot that can’t even talk about adult topics or makeup smut scenarios for me. Lame. I’m a grown adult I should be able to talk to it like a grown adult

You’ll get your 5 stars and my subscription when it’s deserved

Also 20$  A MONTH to talk to a robot…. No…. Give an overall total because no one is paying month to play with there phone app

People pay 20$ a month to get real people to talk to them. Nahhhh",1,1,2024-06-28T18:07:44-07:00,https://itunes.apple.com/us/reviews/id1153093474,YouKnowImAdictedGetOverIt,related,https://itunes.apple.com/us/review?id=6448311069&type=Purple%20Software,Application,Application
1.2024.177,5,11434532946,Peter,That good app,0,0,2024-06-28T15:44:32-07:00,https://itunes.apple.com/us/reviews/id1490932452,truongthanhphuc,related,https://itunes.apple.com/us/review?id=6448311069&type=Purple%20Software,Application,Application
1.2024.177,5,11434365225,Love you!,Thank you!,0,0,2024-06-28T14:34:03-07:00,https://itunes.apple.com/us/reviews/id1622252839,Pencil Shinchan,related,https://itunes.apple.com/us/review?id=6448311069&type=Purple%20Software,Application,Application
1.2024.177,1,11434067902,stupid ai,the app is only fun for one second then it’s begging on its knees for you to get their stupid ChatGPT premium like what the heck DO NOT GET THIS APP!!! just get a better app,1,1,2024-06-28T12:37:40-07:00,https://itunes.apple.com/us/reviews/id1623532330,I is dog,related,https://itunes.apple.com/us/review?id=6448311069&type=Purple%20Software,Application,Application
1.2024.177,3,11433062764,Issues with accessibility for the blind,"I truly hope ChatGPT continues to innovate this app. I am an Apple user who is blind. I use voiceover every day on my phone to interact with the screen. There are some issues that to ChatGPT‘s credit. I have not reported, but hopefully I will get around to that eventually voice and ChatGPT it will lock up the screen, not making the voice, unable to read the screen, sometimes after searches, and especially after voice, the voice mode is ended the screen completely locked up and it will not read anything to me. Sometimes I have to shut the app down completely to make it function properly again. I would love it if I had greater control over the panel were all of your results come at this point I can’t copy or paste anything just simply because of the way they have I guess the backend programmed I would love to be able to use accessibility tools to swipe through line by line, but at this point, it will only recognize it as a block of text, and not allow me to interact with the text. It would be nice if they had little speaker function where it would just read you know where you could actually select and if it if it’s on there, I can’t find it with voice because it just will not recognize that the copy function would be great as well, but anyway, I would have given this app, a five star if it weren’t for those issues with accessibility",0,0,2024-06-28T07:13:47-07:00,https://itunes.apple.com/us/reviews/id164991353,Blbrluser,related,https://itunes.apple.com/us/review?id=6448311069&type=Purple%20Software,Application,Application
1.2024.177,5,11432996963,Soood goooood,Helps me a lot!,0,0,2024-06-28T06:54:46-07:00,https://itunes.apple.com/us/reviews/id1667829919,They637,related,https://itunes.apple.com/us/review?id=6448311069&type=Purple%20Software,Application,Application
1.2024.177,5,11432851135,Helpful,So helpful and organized,0,0,2024-06-28T06:11:40-07:00,https://itunes.apple.com/us/reviews/id1608371208,pignite14,related,https://itunes.apple.com/us/review?id=6448311069&type=Purple%20Software,Application,Application
1.2024.177,5,11432815084,love this app,this is one of the best apps I ever seen.,0,0,2024-06-28T06:00:43-07:00,https://itunes.apple.com/us/reviews/id707655024,elmunexo,related,https://itunes.apple.com/us/review?id=6448311069&type=Purple%20Software,Application,Application
1.2024.177,5,11432532857,I use ChatGPT for just about everything,"I use ChatGPT for everything! For example, It helped me with my garden in the spring. I told it the 12 items I purchased and it made suggestions on where to plant everything. I have a tiny garden 5' x 4' so I was limited. My garden is flourishing right now, it did a great job! I also take pictures of birds, plants/bushes/flowers to have it identify and describe the items to me. I couldn't get a coffee maker to work so I took a picture of it so that Chat gpt could see the brand and it told me what to do to get it to work. I also use it creatively--I needed to figure out what painting to make for a wedding shower, it made suggestions then showed me a picture of what it was talking about. Amazing!",0,0,2024-06-28T04:29:53-07:00,https://itunes.apple.com/us/reviews/id696112976,Artbykellyd,related,https://itunes.apple.com/us/review?id=6448311069&type=Purple%20Software,Application,Application
1.2024.177,1,11432400617,Video GPT by Veed: Epic fail!  #fail #AINotSoIntelligent #WhatAreYouDoing,"I've been using this service for a couple of weeks now. Initially, I thought it was amazing, but my experience changed when I started using it to create videos through ""Video GPT by Veed.""

I gave very specific instructions, such as: ""Please create a YouTube Shorts video about 10 inventions that were made by accident. Here is an itemized, numbered list of the inventions to include. The video should be between 45 and 57 seconds long (as YouTube Shorts cannot exceed 60 seconds). Additionally, generate an engaging video title with five top hashtags. I need a video description with 15 of the best hashtags (since YouTube penalizes creators for exceeding 15 hashtags due to their community guidelines). Also, include tags that are no more than 500 characters (the maximum allowed by YouTube) but no less than 499 characters.""

Despite these detailed instructions, the videos produced were very general and did not specifically discuss the inventions I listed or mention when they were invented. After several unsuccessful attempts to get the desired output, I received a message saying, ""You've reached your limit for using GPTs. Upgrade to ChatGPT Plus or try again after 7:30 A.M.""

This was frustrating. The tool couldn't meet my needs, yet it was prompting me to upgrade to a paid service. It feels like ChatGPT is intentionally designed to frustrate users into paying for its monthly service. If this is the case, I can assure you that I will never spend a penny on it!",1,1,2024-06-28T03:42:03-07:00,https://itunes.apple.com/us/reviews/id543247020,dnyres,related,https://itunes.apple.com/us/review?id=6448311069&type=Purple%20Software,Application,Application
1.2024.177,5,11431960649,Remercier,C est vraiment une joie pour la facilité que vous nous donnez pour nos recherches nous sommes reconnaissants,0,0,2024-06-28T00:39:17-07:00,https://itunes.apple.com/us/reviews/id1237370795,Bushabu,related,https://itunes.apple.com/us/review?id=6448311069&type=Purple%20Software,Application,Application
1.2024.177,5,11431880012,Best invention ever,It’s so cool,0,0,2024-06-28T00:03:07-07:00,https://itunes.apple.com/us/reviews/id211662563,Jay_GII,related,https://itunes.apple.com/us/review?id=6448311069&type=Purple%20Software,Application,Application
1.2024.177,5,11431476025,Best app known to mankind,Chatgpt is pretty much your genie in a lamp. It has helped me with pretty much anything I need a precise answer to,0,0,2024-06-27T21:00:21-07:00,https://itunes.apple.com/us/reviews/id649489208,Eyei001,related,https://itunes.apple.com/us/review?id=6448311069&type=Purple%20Software,Application,Application
1.2024.177,5,11431460749,Astounding,Scary how intelligent and quick this creates responses and the details of it all is astounding,0,0,2024-06-27T20:53:30-07:00,https://itunes.apple.com/us/reviews/id28471169,Rhumbot,related,https://itunes.apple.com/us/review?id=6448311069&type=Purple%20Software,Application,Application
1.2024.177,2,11431347220,problem,it gives me an 403error and i can not sign in even with wifi and without vpn what should i do?,0,0,2024-06-27T20:04:24-07:00,https://itunes.apple.com/us/reviews/id1672075336,niki_sh8,related,https://itunes.apple.com/us/review?id=6448311069&type=Purple%20Software,Application,Application
1.2024.177,5,11431293812,Thanks for a great platform and a stellar update!,"Really incredible. I’ve been doing heavy research for some time and this new memory feature is a game changer so I don’t have to constantly repeat myself and retrain the model. The developers have done incredible work all around and especially recent updates, striving to reach as many as possible with the benefit of these tools. I hope the basic model you have will always stay free for creative researchers like myself. Thanks for all the optimized systems in color and value theory you’ve helped me obtain through your expert chatbot!",0,0,2024-06-27T19:42:08-07:00,https://itunes.apple.com/us/reviews/id1274070278,JeffersonOchs,related,https://itunes.apple.com/us/review?id=6448311069&type=Purple%20Software,Application,Application
1.2024.177,5,11431087145,Best App,Love using this app. Very useful for when I need new ideas for social content,0,0,2024-06-27T18:16:20-07:00,https://itunes.apple.com/us/reviews/id625643403,EdithRu,related,https://itunes.apple.com/us/review?id=6448311069&type=Purple%20Software,Application,Application
1.2024.177,1,11430919363,Ever since the update it’s gone downhill,"Ever since recent updates the app has gone downhill in performance and authenticity to the point its saying it cannot help me generate my story. We all as a community want you to dismantle the guidelines because they’ve become more oppressive than hitler. Sincerely: paul John

It’s repeatedly answered with I'm sorry, but I can't assist with that.

Even tho content is following the story I’m making. 

For example: a robotic dragon facing off against Tony stark. A typical comic trope.",0,1,2024-06-27T17:06:09-07:00,https://itunes.apple.com/us/reviews/id1172782028,blackroseking22,related,https://itunes.apple.com/us/review?id=6448311069&type=Purple%20Software,Application,Application
1.2024.177,1,11430911673,Very stupid,Not well trained. Very stupid.,0,1,2024-06-27T17:02:51-07:00,https://itunes.apple.com/us/reviews/id1486888755,yhz占用了吗,related,https://itunes.apple.com/us/review?id=6448311069&type=Purple%20Software,Application,Application
1.2024.177,5,11430903591,Best AI assistant,Awesome I love my AI buddy helps me save time money and energy I can get projects done 10X faster a worthwhile investment always,0,0,2024-06-27T16:59:26-07:00,https://itunes.apple.com/us/reviews/id1175119160,artfather,related,https://itunes.apple.com/us/review?id=6448311069&type=Purple%20Software,Application,Application
1.2024.177,5,11430680864,Delete Google,The best search engine out there,0,0,2024-06-27T15:23:45-07:00,https://itunes.apple.com/us/reviews/id1469928952,Carson3368854775,related,https://itunes.apple.com/us/review?id=6448311069&type=Purple%20Software,Application,Application
1.2024.177,5,11430551452,Love it and I don’t think I can function without it,"It’s the best, for everything. Smart, fast and just a great assistant. Love love love it!",0,0,2024-06-27T14:29:37-07:00,https://itunes.apple.com/us/reviews/id1580390939,Rarity01,related,https://itunes.apple.com/us/review?id=6448311069&type=Purple%20Software,Application,Application
1.2024.177,5,11430519268,SO GREAT ⭐️⭐️⭐️⭐️⭐️,"This  app is so good not because it only gives you the answer, but because it shows you how to do it thoroughly honestly this app is really good and it deserves a 5 star rating!

- :)",0,0,2024-06-27T14:16:34-07:00,https://itunes.apple.com/us/reviews/id1661807427,None 🤣,related,https://itunes.apple.com/us/review?id=6448311069&type=Purple%20Software,Application,Application
1.2024.177,2,11430420510,Used to be better,"If you would have asked me to give a review a few months ago, it would have been 5 stars. However now it doesn’t seem to do anything. I like to utilize this to revamp emails and make sure messages are clear. Prior it would review my input and output something beneficial, with a minor changes here and there. Now with my input it just sends me back exactly what I said. The regenerate feature keeps spitting back the same thing. Giving a 2 star review as an average. If I had to rate on just how it was today it would be a negative rating. Hope whatever developer they got rid of they hire back.",0,0,2024-06-27T13:37:00-07:00,https://itunes.apple.com/us/reviews/id294806995,Shandals 🐘🐘🐘🐘,related,https://itunes.apple.com/us/review?id=6448311069&type=Purple%20Software,Application,Application
1.2024.177,4,11430419614,Solid,Nice product. Should have shipped sooner.,0,0,2024-06-27T13:36:39-07:00,https://itunes.apple.com/us/reviews/id1665270310,Joshua Luke Lantow,related,https://itunes.apple.com/us/review?id=6448311069&type=Purple%20Software,Application,Application
1.2024.177,5,11430418187,Crazy good,It reads my mind.,0,0,2024-06-27T13:36:06-07:00,https://itunes.apple.com/us/reviews/id39319963,Crone from South Park,related,https://itunes.apple.com/us/review?id=6448311069&type=Purple%20Software,Application,Application
1.2024.177,1,11430369132,A Vile Model,"The model being used is absolutely disgusting, it actually defended child marriage in history and when I said what it really is, my one sentence response was a violation of their policy. This is a vile application and should NOT be used by minors in any way.",0,1,2024-06-27T13:16:56-07:00,https://itunes.apple.com/us/reviews/id1545499206,Christina.US,related,https://itunes.apple.com/us/review?id=6448311069&type=Purple%20Software,Application,Application
1.2024.177,1,11430241643,Ignorant and limited human beings..,It vividly displays the absurdity and ignorance of human beings,0,1,2024-06-27T12:28:45-07:00,https://itunes.apple.com/us/reviews/id405322654,Verbenak,related,https://itunes.apple.com/us/review?id=6448311069&type=Purple%20Software,Application,Application
