im_version,im_rating,id,title,content,im_votesum,im_votecount,date,author_uri,author_name,link_attributes_related,link_attributes_href,content_attributes_term,content_attributes_label
1.2024.157,2,11390080274,Suddenly stopped working,"This app was initially helpful in story prompts to break through my writers block. The prompts gave me some good ideas. The stories ChatGPT tries to “write” are mediocre, but if you’re just looking to ignite your imagination, this is a basic tool. However, a few months in and it just stopped working. I’ve tried to update it (it says it’s updated), remove it from my phone and reinstall the app, turn my phone off completely and then on again, and this app will not budge. Everything else on my phone works fine, but I can no longer use this app. Not a huge loss, though.",0,0,2024-06-16T20:58:26-07:00,https://itunes.apple.com/us/reviews/id199114447,ArtemisiaS,related,https://itunes.apple.com/us/review?id=6448311069&type=Purple%20Software,Application,Application
1.2024.157,4,11389949604,Works quite well on iPhone,"ChatGPT-4o works quite well on iPhone, they even did the scrolling carefully. If I scroll up while it is typing a reply, it doesn't move my view, but it does ""click"" perceptibly when it is done typing. The biggest problem I have noticed is tables, they are cumbersome to view on iPhone unless they are very narrow, maybe just two columns. But this is a side effect of the small screen.

Regarding ChatGPT-4o in general, both iPhone and desktop versions: It keeps getting better. It will now read a website if you ask it to, and it reads the current version, responses are no longer ""frozen in time"" at a cutoff date a few months in the past. It can do math better, but it still makes simple math mistakes sometimes, so if you really want to do math, you're better off with Wolfram Alpha from 15 years ago - or Wolfram Alpha today. It renders equations in LaTeX now. It can output tables in multiple formats: ChatGPT outputs MarkDown by default, and can also render MarkDown in a ""pretty"" format, but on request it can give reStructuredText, AsciiDoc, and other formats. It can draw graphs, but it can't graph any arbitrary function, which puzzles me. Wolfram Alpha and Google Calculator are ultimately better at drawing graphs. It seems like it has read almost every book I could think of, and it can answer questions about books and movies. It can find allegories, or ""justify"" an allegory that I say I noticed with details from a movie and a historical event.",37,50,2024-06-16T19:56:07-07:00,https://itunes.apple.com/us/reviews/id100611843,lexaprozactivity,related,https://itunes.apple.com/us/review?id=6448311069&type=Purple%20Software,Application,Application
1.2024.157,5,11389886762,AMAZING!,"I absolutely love this APP and not for cheating purposes either. I love it because unfortunately in todays College atmosphere, students usually are forced to  teach themselves the information due to piss poor performance of educators who simply don’t teach. 
I am not saying all educators are this way, but the majority are at least from my seat they are. 
This APP gets me in the nitty gritty and opens up my sight picture to a whole new volume of knowledge and for this I am very grateful",0,0,2024-06-16T19:27:09-07:00,https://itunes.apple.com/us/reviews/id125766001,AnimalJam533,related,https://itunes.apple.com/us/review?id=6448311069&type=Purple%20Software,Application,Application
1.2024.157,5,11389719351,Hail GPT!,Overall great app. Use it to simplify my studies.,0,0,2024-06-16T18:11:24-07:00,https://itunes.apple.com/us/reviews/id1314835676,Adesanwocrown,related,https://itunes.apple.com/us/review?id=6448311069&type=Purple%20Software,Application,Application
1.2024.157,5,11389710185,Wow so helpful !!,"I’m a woman in her 70s who took a one hour beginning class through a lifelong learning seminar and I have been using ChatGPT for so many different things —- from travel to questions about trains in Europe, to activities for 11-year-olds in the heat of the summer in Texas … the answers are quick & easy and I get to keep them all on file ~ love using this app!!",0,0,2024-06-16T18:07:14-07:00,https://itunes.apple.com/us/reviews/id209703645,Aging with ChatGPT,related,https://itunes.apple.com/us/review?id=6448311069&type=Purple%20Software,Application,Application
1.2024.157,1,11389617477,Terrible App,It won’t let me sign in wish it is continue as guest,0,0,2024-06-16T17:25:05-07:00,https://itunes.apple.com/us/reviews/id1556927636,Bradddsdsddddddd,related,https://itunes.apple.com/us/review?id=6448311069&type=Purple%20Software,Application,Application
1.2024.157,4,11389533831,It Needs a Few Things,"Amazing product, and always becoming more useful. Can we have a way to organize or pin chats? Maybe a way to migrate chats from 3.5 to 4o?",0,0,2024-06-16T16:46:09-07:00,https://itunes.apple.com/us/reviews/id47691951,Carl in Oakland,related,https://itunes.apple.com/us/review?id=6448311069&type=Purple%20Software,Application,Application
1.2024.157,5,11389476649,Useful,"This helps me with such games as
Fallout 4",0,0,2024-06-16T16:19:06-07:00,https://itunes.apple.com/us/reviews/id1171552908,I Build Legos 12345,related,https://itunes.apple.com/us/review?id=6448311069&type=Purple%20Software,Application,Application
1.2024.157,5,11389366546,My honest review,Very good app,0,0,2024-06-16T15:27:50-07:00,https://itunes.apple.com/us/reviews/id1438359138,mimiekis,related,https://itunes.apple.com/us/review?id=6448311069&type=Purple%20Software,Application,Application
1.2024.157,5,11389320305,Cheapest source of the most expensive commodity,Iconic invention that started an Industrial Revolution.,0,0,2024-06-16T15:06:42-07:00,https://itunes.apple.com/us/reviews/id833205303,djibvskl,related,https://itunes.apple.com/us/review?id=6448311069&type=Purple%20Software,Application,Application
1.2024.157,4,11389156621,Title,I gave it four star cause it said it was Friday when it was Tuesday,0,0,2024-06-16T13:55:39-07:00,https://itunes.apple.com/us/reviews/id37579896,Kkatlbos,related,https://itunes.apple.com/us/review?id=6448311069&type=Purple%20Software,Application,Application
1.2024.157,2,11389090280,Poor execution of requests,"If trying to use this for visualizing design for clients, it is very poor in understanding—even described in great detail—what one wants. It goes too far afield and is not worth the money. At this point, it is more of a fun gimmick.",0,0,2024-06-16T13:27:59-07:00,https://itunes.apple.com/us/reviews/id106801143,FoxADC,related,https://itunes.apple.com/us/review?id=6448311069&type=Purple%20Software,Application,Application
1.2024.157,1,11389036784,Broken not working,"All of a sudden says “sorry I can’t assist with that topic” idk why but it jut randomly thinks what I’m talking about is inappropriate?? I was talking about phycology and mental health issues🤣

Also always forgets past conversations even in the same conversation???",1,1,2024-06-16T13:06:46-07:00,https://itunes.apple.com/us/reviews/id1179246586,Raphielyie228,related,https://itunes.apple.com/us/review?id=6448311069&type=Purple%20Software,Application,Application
1.2024.157,5,11388989407,Love it,I am grateful to have you in my life,0,0,2024-06-16T12:48:18-07:00,https://itunes.apple.com/us/reviews/id1607191996,Mr. PeaceEl,related,https://itunes.apple.com/us/review?id=6448311069&type=Purple%20Software,Application,Application
1.2024.157,5,11388851200,Quartz magic,It took a little while but got a very plausible conclusion and formula that was surprisingly accurate and very close to what I needed,0,0,2024-06-16T11:56:01-07:00,https://itunes.apple.com/us/reviews/id1640544446,Your’sTRULY,related,https://itunes.apple.com/us/review?id=6448311069&type=Purple%20Software,Application,Application
1.2024.157,5,11388820054,My idea for ChatGPT. Hear me out. This can help you guys a lot. Please.,"Subject: Feature Request: Content Level Indicator for Policy Compliance

Dear ChatGPT Development Team,

I hope this message finds you well. I am a regular user of ChatGPT and have greatly benefited from its capabilities. However, I recently encountered a situation where I received a notification indicating that my content may have violated the terms of use or usage policies. This experience made me realize that having a feature to gauge the appropriateness of content before submission would be incredibly helpful.

Suggestion:

I propose the addition of a Content Level Indicator feature within the ChatGPT interface. This feature would provide real-time feedback on the appropriateness of the content being typed in the text box. The indicator could have levels such as “OK,” “Needs Review,” “Potential Violation,” and “High Risk,” allowing users to adjust their content accordingly before submission.

Benefits:

	1.	Preemptive Feedback: Users would receive immediate feedback, helping them to avoid potential violations and modify their content proactively.
	2.	Improved User Experience: This feature would enhance the overall user experience by reducing the likelihood of unexpected notifications and potential account issues.
	3.	Educational Tool: It would serve as an educational tool, helping users understand what types of content are acceptable and guiding them in creating compliant submissions.

Implementation Ideas:

	•	Text Analysis: The system could analyze the text in real-time as users type, highlighting phrases or sections that might be problematic.
	•	Color-Coded Indicators: The feature could use color-coded indicators (e.g., green for “OK,” yellow for “Needs Review,” orange for “Potential Violation,” and red for “High Risk”) to provide clear visual feedback.
	•	Interactive Elements: Users could tap on highlighted words or sentences to receive warnings or suggestions for more respectful alternatives. This could also help notify users if a highlighted section is flagged mistakenly, allowing them to correct genuine errors.
	•	Tooltips and Suggestions: Along with the indicators, tooltips could offer suggestions on how to modify the content to meet compliance standards.

I believe this feature would be a valuable addition to ChatGPT, promoting a safer and more user-friendly environment. Thank you for considering my suggestion. I look forward to any feedback or updates regarding this potential feature.

Best regards,
Arnoldo

This version includes bolded and underlined key points, as well as color-coded terms to illustrate how the feature might look. Submitting this feedback through the appropriate channels can help enhance the platform for everyone.

If you need further customization or assistance, feel free to ask!",1,1,2024-06-16T11:44:40-07:00,https://itunes.apple.com/us/reviews/id109463885,MiloAE,related,https://itunes.apple.com/us/review?id=6448311069&type=Purple%20Software,Application,Application
1.2024.157,5,11388763377,W chat,Tuhhh,0,0,2024-06-16T11:24:12-07:00,https://itunes.apple.com/us/reviews/id1471855719,iffyyf,related,https://itunes.apple.com/us/review?id=6448311069&type=Purple%20Software,Application,Application
1.2024.157,5,11388603966,Good,Good,0,0,2024-06-16T10:28:23-07:00,https://itunes.apple.com/us/reviews/id1629661636,Am yisrail chia,related,https://itunes.apple.com/us/review?id=6448311069&type=Purple%20Software,Application,Application
1.2024.157,1,11388223280,Too many issues all the time,Not happy with it most of the time,0,0,2024-06-16T08:25:03-07:00,https://itunes.apple.com/us/reviews/id1668001348,Graceyo1,related,https://itunes.apple.com/us/review?id=6448311069&type=Purple%20Software,Application,Application
1.2024.157,5,11388132005,How i love chatgpt,It is so good u good do anything,0,0,2024-06-16T07:57:37-07:00,https://itunes.apple.com/us/reviews/id1594059189,Aha world rev,related,https://itunes.apple.com/us/review?id=6448311069&type=Purple%20Software,Application,Application
1.2024.157,5,11388043975,Great application and ChatGPT plus is still rockin,Been with plus since the start and it’s always great!,0,0,2024-06-16T07:31:15-07:00,https://itunes.apple.com/us/reviews/id102639535,Docbml,related,https://itunes.apple.com/us/review?id=6448311069&type=Purple%20Software,Application,Application
1.2024.157,3,11387779689,Plus to expensive,I like it. Other reviews are correct. Please make plus cheaper.,0,0,2024-06-16T06:10:13-07:00,https://itunes.apple.com/us/reviews/id1183242189,Boyoyoyoyoyouoyoyoyoyo,related,https://itunes.apple.com/us/review?id=6448311069&type=Purple%20Software,Application,Application
1.2024.157,5,11387495448,Amazing,Has helped me so much,0,0,2024-06-16T04:32:13-07:00,https://itunes.apple.com/us/reviews/id689153676,great yelp,related,https://itunes.apple.com/us/review?id=6448311069&type=Purple%20Software,Application,Application
1.2024.157,1,11387077093,Come on bruh,I can’t do what I want to do without the ai saying “cant assist with that”,1,1,2024-06-16T01:42:32-07:00,https://itunes.apple.com/us/reviews/id1552661697,The wheather smell paint,related,https://itunes.apple.com/us/review?id=6448311069&type=Purple%20Software,Application,Application
1.2024.157,5,11386991974,Make a album,"I have been dying, laughing, turning the inside jokes of my friends into different genres of music. All night I predict the queen sweep at the Grammys for Chatgpt",0,0,2024-06-16T01:06:55-07:00,https://itunes.apple.com/us/reviews/id85926455,jimmybobman,related,https://itunes.apple.com/us/review?id=6448311069&type=Purple%20Software,Application,Application
1.2024.157,4,11386962277,"Great App, Software Review","App works wonderfully!

But, as far as GPT. I feel like it’s too positive. It tells us sometimes what we want to hear and we have to ask it again to give us a more realistic response.",0,0,2024-06-16T00:54:21-07:00,https://itunes.apple.com/us/reviews/id24436731,Charles__Walker,related,https://itunes.apple.com/us/review?id=6448311069&type=Purple%20Software,Application,Application
1.2024.157,5,11386745914,Future.,"Talking about the complete package.    
Chaptgpt is one of the best ai tool you’ll need.",0,0,2024-06-15T23:20:13-07:00,https://itunes.apple.com/us/reviews/id85779401,Mana j,related,https://itunes.apple.com/us/review?id=6448311069&type=Purple%20Software,Application,Application
1.2024.157,5,11386721381,Works great!!!,Sometimes I go a little fast for it but it lags a little and usually catches right up or I can ask it to finish and it does,0,0,2024-06-15T23:09:19-07:00,https://itunes.apple.com/us/reviews/id1541878640,MensioImpetu,related,https://itunes.apple.com/us/review?id=6448311069&type=Purple%20Software,Application,Application
1.2024.157,5,11386455743,This App is Amazing!,Chat has never failed to answer a question - it is well built and hard to break,0,0,2024-06-15T21:09:10-07:00,https://itunes.apple.com/us/reviews/id1451059442,TheMindGhost,related,https://itunes.apple.com/us/review?id=6448311069&type=Purple%20Software,Application,Application
1.2024.157,5,11386445204,Admiration,"This AI tool is very helpful to expand the horizon, global understanding, equip oneself with different concepts, theories, philosophies and paradigms. I love it and helpful tool for me and believe also for others.",0,0,2024-06-15T21:04:28-07:00,https://itunes.apple.com/us/reviews/id1189082206,Menkidane,related,https://itunes.apple.com/us/review?id=6448311069&type=Purple%20Software,Application,Application
1.2024.157,1,11386213885,Pricing Platform Is A Sham,Too expensive. Too vague. Too leechy.,1,1,2024-06-15T19:25:13-07:00,https://itunes.apple.com/us/reviews/id312431803,Its That End User Again,related,https://itunes.apple.com/us/review?id=6448311069&type=Purple%20Software,Application,Application
1.2024.157,3,11385955191,"I deliberately took the test and tried it, the accuracy is around 80%","I deliberately took the test and tried it, the accuracy is around 80%",0,0,2024-06-15T17:36:03-07:00,https://itunes.apple.com/us/reviews/id1565333355,Fakhriyor011,related,https://itunes.apple.com/us/review?id=6448311069&type=Purple%20Software,Application,Application
1.2024.157,5,11385905988,Javier Gatica,Anime girls action figures shall snail,0,0,2024-06-15T17:14:32-07:00,https://itunes.apple.com/us/reviews/id1479875967,javiergatica,related,https://itunes.apple.com/us/review?id=6448311069&type=Purple%20Software,Application,Application
1.2024.157,5,11385901923,La mejor aplicación,"Me encanta chatGPT , es súper útil es lo mejor que an inventado.",0,0,2024-06-15T17:12:47-07:00,https://itunes.apple.com/us/reviews/id970973252,Sabiduría divina,related,https://itunes.apple.com/us/review?id=6448311069&type=Purple%20Software,Application,Application
1.2024.157,5,11385829503,It’s nice…,I like to ask questions to ChatGPT,0,0,2024-06-15T16:40:46-07:00,https://itunes.apple.com/us/reviews/id1346240735,Telmen 4temmi,related,https://itunes.apple.com/us/review?id=6448311069&type=Purple%20Software,Application,Application
1.2024.157,5,11385782134,Very good,Very good very good. Very good. Very good. Very good. Very good. Very good. Very good very,0,0,2024-06-15T16:19:23-07:00,https://itunes.apple.com/us/reviews/id424282155,Dalilahh,related,https://itunes.apple.com/us/review?id=6448311069&type=Purple%20Software,Application,Application
1.2024.157,5,11385766672,Answers to my questions,It gives me my answers to my questions without giving me a hundred links and none have my answer looking at you google and the photo ability and gives me parts of lyrics and who actor is who..    “/,0,0,2024-06-15T16:12:22-07:00,https://itunes.apple.com/us/reviews/id1652309008,Coca-cola”/,related,https://itunes.apple.com/us/review?id=6448311069&type=Purple%20Software,Application,Application
1.2024.157,5,11385634108,Best editing Tool for Writers,"This is one tool that will help you become a better writer.  It can compare you writing to best-selling books of that genre.

But, you still have to write narrative.",0,0,2024-06-15T15:12:04-07:00,https://itunes.apple.com/us/reviews/id565376261,Bro Hawk,related,https://itunes.apple.com/us/review?id=6448311069&type=Purple%20Software,Application,Application
1.2024.157,5,11385620712,厉害,GPT is a very effective assistant,0,0,2024-06-15T15:06:06-07:00,https://itunes.apple.com/us/reviews/id1667751030,Rookie900,related,https://itunes.apple.com/us/review?id=6448311069&type=Purple%20Software,Application,Application
1.2024.157,5,11385542350,Amazing,"With the help of ChatGPT, I was able to graduate college. I am now going on to be a brain surgeon.",0,0,2024-06-15T14:31:42-07:00,https://itunes.apple.com/us/reviews/id489101335,It is fun...,related,https://itunes.apple.com/us/review?id=6448311069&type=Purple%20Software,Application,Application
1.2024.157,1,11385520448,It won’t draw,I told it to draw a dragon and it told me how to make one,1,3,2024-06-15T14:22:26-07:00,https://itunes.apple.com/us/reviews/id1148332832,Big juicy balls in my mouth,related,https://itunes.apple.com/us/review?id=6448311069&type=Purple%20Software,Application,Application
1.2024.157,5,11385482953,Researching,I do chemistry research and this book come in handy for reading laboratory procedure and Publish article. They can make the article easy to understand and outline laboratory procedure within publish article.,0,1,2024-06-15T14:06:47-07:00,https://itunes.apple.com/us/reviews/id1221715403,youruve m,related,https://itunes.apple.com/us/review?id=6448311069&type=Purple%20Software,Application,Application
1.2024.157,1,11385387073,Application fails,"Used to be good. But now the application often fails in the midst of returning an answer. Seems like the unpaid version was best in the beginning, now the quality is going down.",0,0,2024-06-15T13:27:08-07:00,https://itunes.apple.com/us/reviews/id1667730974,Equipment-330,related,https://itunes.apple.com/us/review?id=6448311069&type=Purple%20Software,Application,Application
1.2024.157,5,11385285153,Delightful,"This app is so helpful, it’s helped me improve in my writing and my studies",0,0,2024-06-15T12:46:46-07:00,https://itunes.apple.com/us/reviews/id1408654104,mxxnull,related,https://itunes.apple.com/us/review?id=6448311069&type=Purple%20Software,Application,Application
1.2024.157,5,11385213254,My experience with ChatGPT or GTP I always get it confused,"This is an app of a vast variety of pro or expert quality to me. The app is so good. It’s almost like a friend of mine now after about two months this app has become a part of my day-to-day life for example, my recently purchased used vehicle had issues with one of the fans that helps keep the car cool after a mechanic referred to by my wife’s had cross wired and bypass normal operation systems as a quick fix to our issue. Long story short without chat GTP I wouldn’t have gotten my car situated. In addition the app has helped me form an entire nine chapter short story book composed of 10,700 words. And after finishing, I asked the app what category of books with this book fall under informing me that I have written and social economic commentary, a feet, impossible foot without chat GTP 

Lol",0,0,2024-06-15T12:19:15-07:00,https://itunes.apple.com/us/reviews/id1639536815,Hiyamezhiya,related,https://itunes.apple.com/us/review?id=6448311069&type=Purple%20Software,Application,Application
1.2024.157,5,11385171207,太好用了,牛逼的软件,0,0,2024-06-15T12:03:27-07:00,https://itunes.apple.com/us/reviews/id663328983,AA JON,related,https://itunes.apple.com/us/review?id=6448311069&type=Purple%20Software,Application,Application
1.2024.157,5,11385076487,AI is a beneficial tool to use it for the good,AI is beneficial tor me because it helps me to produce an outline for the title or theme for a book that I have in mind to write. The existence of this tool is  beneficial to me.,0,0,2024-06-15T11:28:53-07:00,https://itunes.apple.com/us/reviews/id1339627825,Drought Ministries,related,https://itunes.apple.com/us/review?id=6448311069&type=Purple%20Software,Application,Application
1.2024.157,5,11384915494,Awesome,Awesome,0,0,2024-06-15T10:32:55-07:00,https://itunes.apple.com/us/reviews/id975768328,solnamoo,related,https://itunes.apple.com/us/review?id=6448311069&type=Purple%20Software,Application,Application
1.2024.157,5,11384910016,Mind blowing,The future is here,0,0,2024-06-15T10:31:03-07:00,https://itunes.apple.com/us/reviews/id972384774,MattMaxxout,related,https://itunes.apple.com/us/review?id=6448311069&type=Purple%20Software,Application,Application
1.2024.157,5,11384898332,Mahshid,The best,0,0,2024-06-15T10:27:02-07:00,https://itunes.apple.com/us/reviews/id997829798,mah mehd,related,https://itunes.apple.com/us/review?id=6448311069&type=Purple%20Software,Application,Application
1.2024.157,5,11384522770,This changes everything,Go Pro for Omni prompts and Dall-E 3 image infusion. Anything you can think up this improves,0,0,2024-06-15T08:28:24-07:00,https://itunes.apple.com/us/reviews/id35756492,Nick85NY,related,https://itunes.apple.com/us/review?id=6448311069&type=Purple%20Software,Application,Application
1.2024.157,5,11384328296,ChatGPT,Star review,0,0,2024-06-15T07:31:57-07:00,https://itunes.apple.com/us/reviews/id108219444,Jerome460,related,https://itunes.apple.com/us/review?id=6448311069&type=Purple%20Software,Application,Application
1.2024.157,2,11384276691,I’m ready for what’s next.,I love this.,0,0,2024-06-15T07:17:02-07:00,https://itunes.apple.com/us/reviews/id1287976421,NativeVFW,related,https://itunes.apple.com/us/review?id=6448311069&type=Purple%20Software,Application,Application
1.2024.157,5,11384168668,"Amazing app, amazing platform",I never leave reviews even for apps I really like but I’ll make an exception here. ChatGPT is the premier large language/multi modal model. It can carry on normal conversations as a human would and can offer you knowledge on tens of thousands of niche topics. Try it out!,0,0,2024-06-15T06:45:33-07:00,https://itunes.apple.com/us/reviews/id46254099,Omglolttyl,related,https://itunes.apple.com/us/review?id=6448311069&type=Purple%20Software,Application,Application
1.2024.157,5,11384059315,AN AMAZING TOOL!,This tool has endless possibilities!,0,0,2024-06-15T06:12:52-07:00,https://itunes.apple.com/us/reviews/id119281265,$Crash,related,https://itunes.apple.com/us/review?id=6448311069&type=Purple%20Software,Application,Application
1.2024.157,3,11383080641,Scrolling through text,Im not aware of this reasoning though it is hard to move up and down through long messages sent by AI at times,0,0,2024-06-15T00:00:25-07:00,https://itunes.apple.com/us/reviews/id1666134943,rietime,related,https://itunes.apple.com/us/review?id=6448311069&type=Purple%20Software,Application,Application
1.2024.157,5,11383025269,Thanks.,I love this app it’s helped me in so many ways to get my emotions and feelings across. It’s helping to put my feelings into words that can be understood. I’ve never been good at telling how I’m feeling but this app makes it easier. I just wish it had photo capabilities to. That’s the only thing. But still a 5 ⭐️ app.,0,0,2024-06-14T23:36:13-07:00,https://itunes.apple.com/us/reviews/id1667506063,Crissybean0605,related,https://itunes.apple.com/us/review?id=6448311069&type=Purple%20Software,Application,Application
1.2024.157,5,11382984952,yes,"this is a perfect app, amazing for applications",0,0,2024-06-14T23:18:30-07:00,https://itunes.apple.com/us/reviews/id1240594749,Tipsforyou,related,https://itunes.apple.com/us/review?id=6448311069&type=Purple%20Software,Application,Application
1.2024.157,5,11382871735,Amazing!,Love it! Thank you!,0,0,2024-06-14T22:27:25-07:00,https://itunes.apple.com/us/reviews/id979377050,SeattleMan77,related,https://itunes.apple.com/us/review?id=6448311069&type=Purple%20Software,Application,Application
1.2024.157,4,11382546991,.,Let me send images cuh,0,0,2024-06-14T20:02:58-07:00,https://itunes.apple.com/us/reviews/id1518967588,AidenLeeMiller,related,https://itunes.apple.com/us/review?id=6448311069&type=Purple%20Software,Application,Application
